<list xmlns:xsi="http://www.w3.org/2001/XMLSchema-instance" xsi:noNamespaceSchemaLocation="../../xsd/champions.xsd">
   <champion>
   <!-- Spawn chance in percents. Sum of chances for all champions shouldn't greater, than 100% -->
       <chance>2</chance>
       <!-- level bounds -->
       <minLvl>1</minLvl>
       <maxLvl>3</maxLvl>
       <!-- identification -->
       <title>PkElfo - epic</title>
       <glow>1</glow><!-- 1 - red or 2 - blue -->
       <!-- rewards multiplier section -->
       <bonusExp>3</bonusExp>
       <bonusSp>3</bonusSp>
       <bonusDrop>3</bonusDrop>
       <bonusDropAdena>3</bonusDropAdena>
       <!-- specific reward('s) -->
       <reward id="57" min="1" max="3" />
       <!-- stats multiplier section -->
       <maxHp>3</maxHp>
       <regHp>2</regHp>
       <maxMp>3</maxMp>
       <regMp>2</regMp>
       <pAtk>2</pAtk>
       <pAtkSpd>2</pAtkSpd>
       <mAtk>2</mAtk>
       <mAtkSpd>2</mAtkSpd>
       <pDef>3</pDef>
       <mDef>3</mDef>
       <moveSpd>2</moveSpd>
   </champion>
</list>